Delf M,Delf F,Helf M,Helf F,Welf M,Welf F,Orc M,Orc F,Khj M,Khj F,Arg M,Arg F,Imp M,Imp F,Nrd M,Nrd F,Brt M,Brt F,Rdg M,Rdg F,InfoId,SpeakerId,SpeakerName,Race,Gender,Faction,Rank,Type,PCRank,GenRank,GenCell,GenClass,GenFaction,Dialogue
,,,,,,,,,,,,,,,,,,,,id_3032422026175608320,,,,,,,Topic,,,,Priest Service,Imperial Cult,"Akatosh is the ultimate God of the Cyrodiilic Empire, where he embodies the qualities of endurance, invincibility, and everlasting legitimacy."
,,,,,,,,,,,,,,,,,,,,id_2805217144658163,,,,,,,Topic,,,,Priest Service,Imperial Cult,Cult members and respectful guests may make offerings and receive blessings at shrines; the faithful of higher ranks need make no offering to receive blessings.
,,,,,,,,,,,,,,,,,,,,id_12499272181368215981,,,,,,,Topic,,,,Priest Service,Imperial Cult,"High Rock encompasses the many lands and clans of Greater Bretony, the Dellese Isles, the Bjoulsae River tribes, and, by tradition, the Western Reach. The rugged highland strongholds and isolated valley settlements have encouraged the fierce independence of the various local Breton clans, and this contentious tribal nature has never been completely integrated into a provincial or Imperial identity. Nonetheless, their language, bardic traditions, and heroic legends are a unifying common legacy."
,,,,,,,,,,,,,,,,,,,,id_32733215011345421007,,,,,,,Topic,,,,Priest Service,Imperial Cult,"In his aspect of Ysmir, 'Dragon of the North', Tiber Septim is also invoked as the patron of questing heroes."
,,,,,,,,,,,,,,,,,,,,id_31955135431556021582,,,,,,,Topic,,,,Priest Service,Imperial Cult,"Morrowind, homeland of the Dunmer peoples, is the northeastmost province of the Tamrielic Empire. Most of the population is gathered in the high uplands and fertile river valleys of central Morrowind, especially around the Inland Sea. The island Vvardenfell is encircled by the Inner Sea, and is dominated by the titanic volcano Red Mountain and its associated ash wastelands; most of the island's population is confined to the relatively hospitable west and southwest coast."
,,,,,,,,,,,,,,,,,,,,id_4372278618013225,,,,,,,Topic,,,,Priest Service,Imperial Cult,"Tiber Septim was born on the continent of Atmora with the name 'Talos'. When he became Emperor of Tamriel, he took a Cyrodilic name -- Tiber Septim, the Dragon of the North."
,,,,,,,,,,,,,,,,,,,,id_1007510872923210445,,,,,,,Topic,,,,Priest Service,Temple,"Blessed Almalexia the Warden is one of the three Immortal God-Kings of Morrowind, a Pillar of the Tribunal, and the patron of Healers and Teachers."
,,,,,,,,,,,,,,,,,,,,id_979252132199512404,,,,,,,Topic,,,,Priest Service,Temple,"The Buoyant Armigers is a small military order of the Temple, exclusively dedicated to and answering to Lord Vivec."
,,,,,,,,,,,,,,,,,,,,id_2497625171292925447,,,,,,,Topic,,,,Priest Service,Temple,The four orders of Ordinators answer to the Alma Rula in Mournhold.
,,,,,,,,,,,,,,,,,,,,id_1907527121442729230,,,,,,,Topic,,,,Priest Service,Temple,"The Tribunal Temple is the native religion of civilized Morrowind. They worship three God-Kings, Almalexia, Sotha Sil, and Vivec, who are known together as the Tribunal. We usually just call it 'The Temple'."
,,,,,,,,,,,,,,,,,,,,id_2111129191127733778,,,,,,,Topic,,,,Savant,,"Altmer are the light-skinned, tall Elven peoples of the Summerset Isles. 'High' is taken to mean variously 'tall', 'proud', and 'culturally snobbish'. In the Empire, 'High Elves' is the common usage. They consider themselves the most civilized culture of Tamriel, and, in truth, the common tongue of the Empire, Tamrielic, is based on their speech and writing, and most of the Empire's arts, crafts, and sciences are derived from High Elven traditions."
,,,,,,,,,,,,,,,,,,,,id_260075610132046171,,,,,,,Topic,,,,Savant,,"Bal Fell is the 'City of Stone', an ancient First Era ruin in the southeastern islands and promontories of Azura's Coast. The site has a nasty reputation, and several Telvanni wizards currently have competing camps of hirelings and adventurers exploring and looting there. Legend says that Bal Fell was built on the site of an ancient Daedric worship center."
,,,,,,,,,,,,,,,,,,,,id_10959198361053430143,,,,,,,Topic,,,,Savant,,"Balmora is the district seat of House Hlaalu, and the largest settlement on Vvardenfell after Vivec City. Good roads lead north to Ald'ruhn and Caldera and south to Pelagiad, Seyda Neen, and Vivec City. The Imperial Legion garrison of Fort Moonmoth lies south of Balmora."
,,,,,,,,,,,,,,,,,,,,id_8613179211848122921,,,,,,,Topic,,,,Savant,,"Betmeri, or 'Beastmen', were the aboriginal inhabitants of Tamriel. Each Beast race has its own distinctive accounts of the mythic era before the coming of Elves and Men; each Beast race is as culturally and physically distinct from one another as it is from Elven and Manish races."
,,,,,,,,,,,,,,,,,,,,id_2411718612126509743,,,,,,,Topic,,,,Savant,,"Chimer -- literally 'the People of the North', an archaic and poetic usage -- were the Elven tribes who followed the prophet Veloth out of the southwest of Tamriel to settle in the lands now known as Morrowind. Dunmer fable says that before their skin turned dark with the Curse, the Dark Elves were known as the Chimer."
,,,,,,,,,,,,,,,,,,,,id_17339189141133213639,,,,,,,Topic,,,,Savant,,"Dunmer -- literally 'the Dark, or Cursed People', or 'Dark Elves' -- are the dark-skinned Elven peoples of the East. 'Dark' is variously understood to mean 'dark-skinned', 'gloomy', and 'ill-favored by fate'. The Dunmer and their national character embrace these various connotations enthusiastically. In the Empire, 'Dark Elves' is the common usage."
,,,,,,,,,,,,,,,,,,,,id_7559167152078917413,,,,,,,Topic,,,,Savant,,"Dwemer -- literally, 'the Deep, or Deep-Counseled or Secretive People' -- are the fabled lost Dwarven race whose ruins and splendid artifacts are scattered across Tamriel. Elves use the term 'Dwemer', connoting variously 'deep-delving', 'profound', and 'close-counseled'; Imperial usage is 'Dwarven', derived in fable from the affectionate regard of the Giant races for their 'little' Dwemer friends."
,,,,,,,,,,,,,,,,,,,,id_231822555209024625,,,,,,,Topic,,,,Savant,,"Ebonheart is the seat of the Imperial government for Vvardenfell district, and a busy center of maritime trade. Castle Ebonheart is the home of Duke Vedam Dren, the district's ruler and Emperor's representative. Also located at Castle Ebonheart are the Vvardenfell District Council chambers and the Hawkmoth Legion garrison. The officers, docks, and warehouses of the East Empire Company are also found in Ebonheart."
,,,,,,,,,,,,,,,,,,,,id_1647531923350923226,,,,,,,Topic,,,,Savant,,"Elves consider themselves the only 'truly human race', being descended directly from the gods, and regard the Manish and Beast races as highly intelligent animals. On the other hand, Imperial scholars consider Men, Elves, and Beastmen as 'men', on the basis that individuals of all three groups can mate with one another."
,,,,,,,,,,,,,,,,,,,,id_2369613016247696787,,,,,,,Topic,,,,Savant,,"High Rock encompasses the many lands and clans of Greater Bretony, the Dellese Isles, the Bjoulsae River tribes, and, by tradition, the Western Reach. The rugged highland strongholds and isolated valley settlements have encouraged the fierce independence of the various local Breton clans, and this contentious tribal nature has never been completely integrated into a provincial or Imperial identity. Nonetheless, their language, bardic traditions, and heroic legends are a unifying common legacy."
,,,,,,,,,,,,,,,,,,,,id_185649903810118615,,,,,,,Topic,,,,Savant,,"House Indoril is one of the five Dunmer Great Houses, and one of the two houses without holdings or interest in Vvardenfell. The city of Mournhold is located in Indoril District, and the Indoril are orthodox and conservative supporters of the Temple and Temple authority. House Indoril is openly hostile to Imperial culture and religion, and preserves many traditional Dunmer customs and practices in defiance of Imperial law."
,,,,,,,,,,,,,,,,,,,,id_1299523011235659910,,,,,,,Topic,,,,Savant,,"I have not heard that there is a cure for skooma addiction. The Khajiit themselves say there is no cure, and they should know. But there is a book I have heard of, 'Confessions of a Dunmer Skooma-Eater', which claims to be a memoir of a Dunmer woman who overcame her addiction to skooma. This book praises skooma, and says that skooma addicts are not necessarily foolish or evil. Dunmer won't carry such a book. Try Vivec, Jobasha's Rare Books, in the Foreign Quarter."
,,,,,,,,,,,,,,,,,,,,id_2260866072990226889,,,,,,,Topic,,,,Savant,,"In Imperial stories, the dark skin and red eyes of the Dunmer derives from 'the Dark Elven Curse', which was caused by a moral taint, a sorcerous curse, and the pernicious environment of the northeastern wastelands, according to various legends and fables. These stories may be plausibly ascribed to western Imperial racial prejudice and fear of the Dark Elves; such legends play no part in the Dunmer's own accounts of their past."
,,,,,,,,,,,,,,,,,,,,id_10696119082769915631,,,,,,,Topic,,,,Savant,,"In Telvanni villages, the settlement is dominated by the wizard's tower, a fantastic organic form grown and sculpted from stems, caps, and root-like holdfasts of the giant native mushrooms. The village itself is comprised of smaller mushroom pods hollowed out for craftsmen and commoners. Open-air markets often include the giant cages displaying the wares of the slavemasters."
,,,,,,,,,,,,,,,,,,,,id_13054588182179727,,,,,,,Topic,,,,Savant,,"Let me tell you about the armor styles most common in Morrowind. The heavy armor styles, called 'Legion' or 'knight' style in the West and 'ebony' style in the East, require great strength and endurance. The light armor styles, called 'militia' in the West and 'Ashlander' in the East, favor speed and agility. The medium armor styles, called 'Imperial guard' in the West and 'Great House' in the East, are compromises between the heavy and light styles, balancing protection against mobility."
,,,,,,,,,,,,,,,,,,,,id_3248109761802924673,,,,,,,Topic,,,,Savant,,"Morrowind is the northeastmost province of the Tamrielic Empire, bounded on the north and east by the Sea of Ghosts, on the west by Skyrim, on the southwest by Cyrodiil (also known as the Imperial Province), and on the south by Black Marsh (also known as Argonia.) The southeast is a warm coastal plain with broad cultivated areas and marshes and swamps similar to those found in Black Marsh. The west and south-central region is mountainous and sparsely populated."
,,,,,,,,,,,,,,,,,,,,id_1763323927231112605,,,,,,,Topic,,,,Savant,,"Offspring of inter-racial matings have the racial appearance of the mother, but may occasionally share inherited characteristics and abilities of the father. Sloads, dragons, and other sentient races cannot mate with Men, Elves, or Beastmen, and are not considered 'human'. Exceptional accounts of matings between men and daedra do not fit smoothly into this scheme."
,,,,,,,,,,,,,,,,,,,,id_2556827756858326485,,,,,,,Topic,,,,Savant,,"Only a ranking challenging noble or a Morag Tong may attack the marked noble; in modern times, Houses routinely engage Morag Tong. This custom permits Houses to war upon one another on a small scale without threatening public peace and rule of law. Such violent disputes among Great Houses are called 'House Wars'."
,,,,,,,,,,,,,,,,,,,,id_2425981251687011441,,,,,,,Topic,,,,Savant,,"The Ascadian Isles are the lush, green, well-watered lowlands in the south where most of Vvardenfell's agriculture is found. The area includes Pelagiad, Suran, Vivec City, and Ald Sotha along with the inland lakes and waterways of the Ascadian Isles proper. The urban areas of Vivec and Ebonheart of the southern coast are densely populated; the inland Ascadian Isles are dotted with small farms and large plantations. The climate is temperate and comfortable, with moderate rainfall."
,,,,,,,,,,,,,,,,,,,,id_16083133642987427334,,,,,,,Topic,,,,Savant,,"The Blades is a prestigious service order for citizens demonstrating the greatest loyalty to the Emperor. To be named to the Blades by the Emperor is a great honor, and publicly acknowledged members serve openly in noble courts and diplomatic posts. Privately, many Blades members act as the Empire's intelligence agency. Such agents conceal themselves with secret identities, operating in disguise as couriers, observers, and spies throughout the Empire."
,,,,,,,,,,,,,,,,,,,,id_270821422106013908,,,,,,,Topic,,,,Savant,,"The Bosmer are the clanfolk of the Western Valenwood forests. In the Empire, they are called 'Wood Elves', but they call themselves the Bosmer, or the 'Tree-Sap' people. They scorn pretense and formality, preferring a romantic, simple existence in harmony with the wild beauty of nature. They are nimble and quick in body and wit, and there are no finer archers in all of Tamriel."
,,,,,,,,,,,,,,,,,,,,id_4371325022824424232,,,,,,,Topic,,,,Savant,,"The dominant feature of Vvardenfell, Red Mountain is a vast volcano in the center of Vvardenfell. The outer slopes are steep and rugged, and the crater is deep and dotted with surface lava. The Ghostfence, a magical barrier which blocks travel as well as seals in the harmful, disease-laden weather called 'blight', rings the volcano's outer slopes, and is broken only at Ghostgate. Within the Ghostfence, rain never falls and the sun never shines; the only weather is the red and deadly ash-blight."
,,,,,,,,,,,,,,,,,,,,id_7006189001994821187,,,,,,,Topic,,,,Savant,,"The Empire of Tamriel encompasses the nine Imperial provinces: Skyrim, High Rock, Hammerfell, Summerset Isle, Valenwood, Elsweyr, Black Marsh, Morrowind, and the ancient Imperial province itself, Cyrodiil. Dating from the First Era Cyrodiilic Empire, the Empire is almost 4000 years old. But more properly, the current Empire dates from the beginning of the Third Era and the crowning of Tiber Septim as Emperor of Morrowind over 400 years ago. The current emperor is Uriel Septim, 24th of the Septim line."
,,,,,,,,,,,,,,,,,,,,id_2317021167200696362,,,,,,,Topic,,,,Savant,,"The Morag Tong is an assassins guild sanctioned by the Empire to provide three varieties of execution: public executions, private executions, and House Wars executions. Constrained by ancient traditions and rigid codes of conduct, the Morag Tong only recruits candidates of proven skill and honor. Morag Tong only accepts legally approved contracts called 'writs', but rumor hints at the execution of secret extralegal 'grey writs'. The Morag Tong is the sworn enemy of the Dark Brotherhood."
,,,,,,,,,,,,,,,,,,,,id_137691047816744248,,,,,,,Topic,,,,Savant,,"The rocky, rugged archipelago of the northeast is also sparsely populated. Most of the population is gathered in the high uplands and fertile river valleys of central Morrowind, especially around the Inland Sea. The island of Vvardenfell is dominated by the titanic volcano Red Mountain and its associated ash wastelands; most of the island's population is confined to the relatively hospitable west and southwest coast."
,,,,,,,,,,,,,,,,,,,,id_11761285221415415102,,,,,,,Topic,,,,Savant,,"The Tribunal Temple is the native religion of civilized Morrowind. They worship three God-Kings, Almalexia, Sotha Sil, and Vivec, who are known together as the Tribunal. Followers usually just call it 'The Temple'."
,,,,,,,,,,,,,,,,,,,,id_15399325852622113075,,,,,,,Topic,,,,Savant,,"The unarmed, unarmored martial arts traditions of the Marshmerrow, Salt Rice, and Golden Reed societies of the Dissident Priests, patterned on the 'Rain-of-Sand' fighting styles of Elsweyr, are slow to be adopted in the Empire, associated as they are with the ascetic renunciation of worldly wealth and material goods, and the rigid disciplines and mystical philosophies so alien to the Imperial West."
,,,,,,,,,,,,,,,,,,,,id_129485843246921419,,,,,,,Topic,,,,Savant,,"There are three cultures on Vvardenfell: the nomadic Ashlanders: the settled House Dunmer, and the Western Imperial colonists of all races. Ashlanders are few in number, and confined to wilderness regions. House Dunmer live everywhere, in towns, villages, manors, and farms. The Western Imperial colonists live mostly in the towns and villages of the southwest."
,,,,,,,,,,,,,,,,,,,,id_7022303201609527301,,,,,,,Topic,,,,Savant,,"Vvardenfell District's Grand Council, presided over by the sovereign Lord Vedam Dren, Duke of Ebonheart and Vvardenfell, is dominated by five interest groups: the three Great Houses, the Temple, and the Imperial colonists. The Temple and House Redoran are champions of ancient Dunmer customs and privileges, and uncompromising and intolerant worshippers of the native religion called the Tribunal Temple, which venerates three immortal god-kings -- Lord Vivec, Lord Sotha Sil, and Lady Almalexia."
,,,,,,,,,,,,,,,,,,,,id_1563613919209563316,,,,,,,Topic,,,,Savant,,"Vvardenfell is one of the six Imperial administrative districts of Morrowind. Vvardenfell district encompasses Vvardenfell Island, a great land mass dominated by the giant volcano Red Mountain and cut off from mainland Morrowind by the surrounding Inner Sea. The portion of the Padomaic Ocean lying north of Vvardenfell is known as the Sea of Ghosts."
,,,,,,,,,,,,,,,,,,,,id_2726528952606222692,,,,,,,Topic,,,,Savant Service,,"I have not heard that there is a cure for skooma addiction. The Khajiit themselves say there is no cure, and they should know. But there is a book I have heard of, 'Confessions of a Dunmer Skooma-Eater', which claims to be a memoir of a Dunmer woman who overcame her addiction to skooma. This book praises skooma, and says that skooma addicts are not necessarily foolish or evil. Dunmer won't carry such a book. Try Vivec, Jobasha's Rare Books, in the Foreign Quarter."
,,,,,,,,,,,,,,,,,,,,id_24321323592283829553,,,,,,,Topic,,,,Savant Service,,"The Blades is a prestigious service order for citizens demonstrating the greatest loyalty to the Emperor. To be named to the Blades by the Emperor is a great honor, and publicly acknowledged members serve openly in noble courts and diplomatic posts. Privately, many Blades members act as the Empire's intelligence agency. Such agents conceal themselves with secret identities, operating in disguise as couriers, observers, and spies throughout the Empire."
,,,,,,,,,,,,,,,,,,,,id_2518461387288412,,,,,,,Topic,,,,Scout,,"Morrowind is the northeastmost province of the Tamrielic Empire, bounded on the north and east by the Sea of Ghosts, on the west by Skyrim, on the southwest by Cyrodiil (also known as the Imperial Province), and on the south by Black Marsh (also known as Argonia.) The southeast is a warm coastal plain with broad cultivated areas and marshes and swamps similar to those found in Black Marsh. The west and south-central region is mountainous and sparsely populated."
,,,,,,,,,,,,,,,,,,,,id_920286171626610011,,,,,,,Topic,,,,Scout,,"The rocky, rugged archipelago of the northeast is also sparsely populated. Most of the population is gathered in the high uplands and fertile river valleys of central Morrowind, especially around the Inland Sea. The island of Vvardenfell is dominated by the titanic volcano Red Mountain and its associated ash wastelands; most of the island's population is confined to the relatively hospitable west and southwest coast."
,,,,,,,,,,,,,,,,,,,,id_1464514820141361376,,,,,,,Topic,,,,Scout,,"Vvardenfell district encompasses Vvardenfell Island, a great land mass dominated by the giant volcano Red Mountain and cut off from mainland Morrowind by the surrounding Inner Sea. The portion of the Padomaic Ocean lying north of Vvardenfell is known as the Sea of Ghosts."
,,,,,,,,,,,,,,,,,,,,id_7892176062394826081,,,,,,,Topic,,,,Sorcerer,,"I don't know whether vampirism is a disease. And if it is a disease, I don't know if it can be cured, or how. But I have heard rumors of a cure for vampirism. And I recall reading a reference in a rare local book that might be useful. Look for a book called 'Vampires of Vvardenfell, Volume II'. It might be hard to find here. It was suppressed by the Temple. But I recall reading something there about a Buoyant Armiger who became a vampire, but who was cured."
,,,,,,,,,,,,,,,,,,,,id_24784194301716821918,,,,,,,Topic,,,,Trader,,"The local Dunmer liquor, sujamma, is extremely potent, and indulgence results in elevated spirits and diminished mental faculties. Has a kick like a guar -- very strong, and just as stupid."
,,,,,,,,,,,,,,,,,,,,id_2051192453096929045,,,,,,,Topic,,,,Trader Service,,"Fortify potions temporarily increase attributes and abilities. Fortify potions include: fortify strength, fortify intelligence, fortify willpower, fortify agility, fortify speed, fortify personality, fortify luck, fortify health, fortify magicka, fortify fatigue, and fortify endurance."
,,,,,,,,,,,,,,,,,,,,id_311292777396029520,,,,,,,Topic,,,,Trader Service,,"I am a trader, a general merchant. I buy and sell a little of everything -- weapons, armor, clothes, books, miscellaneous items of all kinds. Take a look around; let me know what you want. Or if you have things you'd like to sell, let me take a look at them, and I'll give you a price."
,,,,,,,,,,,,,,,,,,,,id_3190830075182711833,,,,,,,Topic,,,,Trader Service,,"The local Dunmer liquor, sujamma, is extremely potent, and indulgence results in elevated spirits and diminished mental faculties. Has a kick like a guar -- very strong, and just as stupid."
,,,,,,,,,,,,,,,,,,,,id_277571563029963872,,,,,,,Topic,,,,,Ashlanders,"They call them 'corprus beasts'. They come from Red Mountain. Once they were men. Then blight storms come. They walk in the storms. They get sick, grow fat and stupid. Now they wander like mad beasts, killing and eating. Very bad, very bad."
,,,,,,,,,,,,,,,,,,,,id_30852233772068229000,,,,,,,Topic,,,,,Blades,"I am %name, %class."
,,,,,,,,,,,,,,,,,,,,id_2520438912222214746,,,,,,,Topic,,,,,Camonna Tong,An outlander is anyone born and raised outside of Morrowind. You. And the Camonna Tong doesn't like outlanders. Thanks for asking.
,,,,,,,,,,,,,,,,,,,,id_114261397685929617,,,,,,,Topic,,,,,Camonna Tong,"Morrowind was a great nation when the Empire was a bunch of savages running around in skins with clam shells tied to sticks. And Morrowind is still a great nation, and the Dunmer a great people."
,,,,,,,,,,,,,,,,,,,,id_23576220211423514324,,,,,,,Topic,,,,,Camonna Tong,"You want my advice, outlander? Stay clear of the Camonna Tong. We don't like outlanders."
,,,,,,,,,,,,,,,,,,,,id_28747795748431438,,,,,,,Greeting,,,,,Fighters Guild,"With such a high price on your head, everyone assumes you are a murderer. I don't know the details, and don't want to know. But the %Faction won't be pleased. We're judged by your actions, and we don't need thugs like you getting us a reputation as murderers."
,,,,,,,,,,,,,,,,,,,,id_31394300072970130495,,,,,,,Topic,,,,,Fighters Guild,"Your duties are to your Lords and brethren. In all ways, proceed with honor and valor. Keep a keen and watchful mind and never succumb to the craven tricks of the weak. It is traitorous to fight with or thieve from other members of your guild. If you break these rules, you must speak with at least a Warder of the Guild to redeem your standing."
,,,,,,,,,,,,,,,,,,,,id_14276235221591216738,,,,,,,Topic,,,,,Hlaalu,He's the brother of Duke Vedam Dren and a very wealthy and influential man. He has a netch ranch in the Ascadian Isles.
,,,,,,,,,,,,,,,,,,,,id_384018574277275746,,,,,,,Topic,,,,,Hlaalu,"The rules of House Hlaalu are simple. You must never interfere with the business of House Hlaalu. Or if you do, be sure you are not caught. If you're never caught stealing from a member or attacking a member, you'll be fine. If you are expelled, you will have to make amends."
,,,,,,,,,,,,,,,,,,,,id_11339160892159422745,,,,,,,Greeting,,,,,Hlaalu,"With such a high price on your head, everyone assumes you are a murderer. I don't know the details, and don't want to know. But the %Faction won't be pleased. We're judged by your actions, and we don't need thugs like you getting us a reputation as murderers."
,,,,,,,,,,,,,,,,,,,,id_2162127882539027671,,,,,,,Topic,,,,,Imperial Cult,"You are now a %NextPCRank in the Imperial Cult. Welcome, %PCName, to our community, and may you rejoice in its blessings. Can I tell you about our services? Or, if you can donate more time and effort, would you like to become a lay servant?"
,,,,,,,,,,,,,,,,,,,,id_72131109139413990,,,,,,,Topic,,,,,Imperial Cult,"You are now a %NextPCRank in the Imperial Cult. Welcome, %PCName, to our community, and may you rejoice in its blessings. Can I tell you about our services? Or, if you can donate more time and effort, would you like to become a lay servant?"
,,,,,,,,,,,,,,,,,,,,id_2676369343225521846,,,,,,,Topic,,,,,Imperial Legion,Argonian abolitionists are outraged that the Empire does so little to suppress persistent illegal cross-border slave raiding in southern Morrowind.
,,,,,,,,,,,,,,,,,,,,id_31228123011781867,,,,,,,Topic,,,,,Imperial Legion,"I cannot give you advancement anymore. Talk to the Knight of the Imperial Dragon, Varus Vantinius, in Ebonheart."
,,,,,,,,,,,,,,,,,,,,id_2515643532504519053,,,,,,,Topic,,,,,Imperial Legion,"Most Imperial citizens assume the practice will die out as Morrowind adopts Imperial ways, and the subject excites little passion except among Argonian abolitionists."
,,,,,,,,,,,,,,,,,,,,id_259942865635092117,,,,,,,Topic,,,,,Imperial Legion,"Nobody is going to hold your hand in the Legion. In the Imperial cult, they just test your faith and your shoe leather. But here, if your superior gives you orders, and you find you're out of your depth, you're supposed to be smart enough to be patient, get some training, experience, and new equipment, and try it again later when you're better prepared."
