Delf M,Delf F,Helf M,Helf F,Welf M,Welf F,Orc M,Orc F,Khj M,Khj F,Arg M,Arg F,Imp M,Imp F,Nrd M,Nrd F,Brt M,Brt F,Rdg M,Rdg F,InfoId,SpeakerId,SpeakerName,Race,Gender,Faction,Rank,Type,PCRank,GenRank,GenCell,GenClass,GenFaction,Dialogue
,,,,,,,,,,,,,,,,,,,,id_315858128770220336,,,,,,,Topic,,,Vivec,Scout,,"Bal Fell is the 'City of Stone', an ancient First Era ruin in the southeastern islands and promontories of the Ascadian Isles."
,,,,,,,,,,,,,,,,,,,,id_176422811132185326,,,,,,,Topic,,,Vivec,Scout,,"The Ascadian Isles are the lush, green, well-watered lowlands in the south where most of Vvardenfell's agriculture is found."
,,,,,,,,,,,,,,,,,,,,id_32348105661899616090,,,,,,,Topic,,,Vivec,Scout,,"The Erabenimsun are the Ashlanders of Molag Amur, a barren wasteland of rock, lava, and smoke southeast of Red Mountain. Erabenimsun camp is inland, halfway between the coast and Red Mountain. Here. Let me mark it on your map. The nearest settlement is the stronghold oasis of Molag Maar, on the southeast coast of Vvardenfell. You can get a ship from Vivec to Molag Maar, or silt strider from Suran to Molag Maar. From Molag Mar, head north cross-country -- very nasty country -- to Erabenimsun camp."
,,,,,,,,,,,,,,,,,,,,id_46782757314215472,,,,,,,Topic,,,Vivec,,,"Oh, wondrous is Farvyn Oreyn, the powerful battlemage! He single-handedly slew a Daedroth Lord who wished to enslave us all. Even now, he has traveled with his servants to Gnaar Mok, to rid that poor town of some evil presence."
,,,,,,,,,,,,,,,,,,,,id_232964653957129642,,,,,,,Topic,,,Vivec,,,"You'd think she'd be more discreet, seeing as how the Duke's her father. But Ilmeni Dren is a strong-willed young woman, and she hates slavery with a passion. Her family's wealth and influence means nothing to her. She's proud of living in a St. Delyn slum. And she doesn't mind being seen with known abolitionists like that bookseller, Jobasha."
,,,,,,,,,,,,,,,,,,,,id_24913246582699210348,,,,,,,Topic,,,"Vivec, Foreign Quarter",,,"House Redoran has been sending groups of mercenaries against the rogue Telvanni bases cropping up out in Molag Amur and the Ashlands. They don't seem to be having much luck, even though these rogue Telvanni are small fry compared to the mage-lords of the Telvanni towers. Maybe the hard-headed Redorans are sticking too closely to the armored-knight charge-and-bash drill. Maybe someone with a little subtlety might do better."
,,,,,,,,,,,,,,,,,,,,id_29257297663145916153,,,,,,,Topic,,,"Vivec, Foreign Quarter",,,"Now that they found Lesley's little hole over by Ebonheart, where do you suppose he's moved his operation? It's got to be close by, with the volume of stuff she's smuggling."
,,,,,,,,,,,,,,,,,,,,id_244821213120041004,,,,,,,Topic,,,"Vivec, Foreign Quarter",,,"Now that they found Lesley's little hole over by Ebonheart, where do you suppose he's moved his operation? It's got to be close by, with the volume of stuff she's smuggling."
,,,,,,,,,,,,,,,,,,,,id_5996315081541010637,,,,,,,Topic,,,"Vivec, Foreign Quarter",,,So Herd the Bandit has become Herd the Pirate? I guess he's decided to try his luck with sea-going banditry. How do you like the idea of Herd and his mob in a boat? I hope they've invested in water-breathing potions.
,,,,,,,,,,,,,,,,,,,,id_6313250402784718549,,,,,,,Topic,,,"Vivec, Guild of Mages",,Mages Guild,"With Trebonius gone you'll have to ask the guild stewards in Ald'ruhn, Balmora, and Sadrith Mora instead."
,,,,,,,,,,,,,,,,,,,,id_113033264784513703,,,,,,,Topic,,,"Vivec, Guild of Mages",,,Try Jobasha's Rare Books in the Foreign Quarter.
,,,,,,,,,,,,,,,,,,,,id_7209125512447918765,,,,,,,Topic,,,"Vivec, Hlaalu",,,The guys who are making the REAL money are the tax agents and bureaucrats. They take their percentages off the top.
,,,,,,,,,,,,,,,,,,,,id_1426110387813510083,,,,,,,Topic,,,"Vivec, Hlaalu",,,"You've got to hand it to the little daemon-charmers. They surprised us. The Telvanni got these little groups squatting down all over the island, and we've done little to stop them. They're going to be tough to root out. It's going to cost money and lives. But we better make the investment now, before it's too late."
,,,,,,,,,,,,,,,,,,,,id_10848178571187819147,,,,,,,Topic,,,"Vivec, Hlaalu Prison Cells",,,"You have the key. Will you free me, %PCName?"
,,,,,,,,,,,,,,,,,,,,id_13951271023028232135,,,,,,,Topic,,,"Vivec, Redoran",,,"Faral Retheran, the treasurer, is in the Redoran Vaults. Various other Redoran lords and retainers live here in Redoran Compound. Telvanni live in Telvanni Compound. Hlaalu are in Hlaalu Compound, but also in St. Delyn and St. Olms Cantons. Temple priests, clerks, and Ordinators are in the Hall of Wisdom and the Hall of Justice. Some fighters live and train at the Arena. Imperial guildsmen are in the Foreign Quarter."
,,,,,,,,,,,,,,,,,,,,id_3921184082667829299,,,,,,,Topic,,,"Vivec, Redoran",,,"House Redoran has been sending groups of mercenaries against the rogue Telvanni bases cropping up out in Molag Amur and the Ashlands. They don't seem to be having much luck, even though these rogue Telvanni are small fry compared to the mage-lords of the Telvanni towers. Maybe the hard-headed Redorans are sticking too closely to the armored-knight charge-and-bash drill. Maybe someone with a little subtlety might do better."
,,,,,,,,,,,,,,,,,,,,id_21564238712829313073,,,,,,,Topic,,,"Vivec, Redoran",,,I heard someone kidnapped Miner Arobar's daughter.
,,,,,,,,,,,,,,,,,,,,id_57785304475526395,,,,,,,Topic,,,"Vivec, St. Olms",,,"All sorts of people live here in St. Olms. Two Hlaalu lords also live here -- Yngling Half-Troll and Dram Bero. A number of Hlaalu lords and retainers live in Hlaalu Compound and in St. Olms. Redorans live in Redoran Compound and Telvanni live in Telvanni Compound. Temple priests, clerks, and Ordinators are in the Hall of Wisdom and the Hall of Justice. Some fighters live and train at the Arena. Imperial guildsmen are in the Foreign Quarter."
,,,,,,,,,,,,,,,,,,,,id_910791962533326848,,,,,,,Topic,,,"Vivec, Telvanni Prison Cells",,,"You have the key. Will you free me, %PCName?"
,,,,,,,,,,,,,,,,,,,,id_20172134881549327566,,,,,,,Topic,,,Vos,Farmer,,"Rels Tenim? He's a bandit. He stole some guar, and some crops, and I don't know what else. I don't know where he is now, but the Ahemmusa might know. Check at the Ahemmusa Camp north of here."
,,,,,,,,,,,,,,,,,,,,id_1599198711327627129,,,,,,,Greeting,,,Vos,,,"What do you want, outlander? I'll tell you now, we haven't much in the way of services in Vos."
,,,,,,,,,,,,,,,,,,,,id_62574413954430380,,,,,,,Topic,,,Yassu Mine,Miner,,"I'm a raw glass miner. The raw glass deposits here on Vvardenfell are the richest in the world. The matrix is a very hard stone, and separating raw glass from the matrix is hard work. Hard, honest work that pays well."
,,,,,,,,,,,,,,,,,,,,id_16264196901221710107,,,,,,,Topic,,,Zainab Camp,,,"Trade goods we have in plenty. What, does the outlander think we are savages? Because we do not have the things the settled people have? Big buildings? Heavy furniture? We have no use for this trash. And do we need to dress ourselves in foolish clothes and stand about with fancy weapons to feel like men? Hah. But of course you do not know the Ashlanders. It is not your fault, outlander."
,,,,,,,,,,,,,,,,,,,,id_4789216531527029884,,,,,,,Topic,,,Zainab Camp,,,"We Zainab make everything we need. We do not need things from outsiders. But... our men get common diseases and blight diseases when they go out hunting or tending the herds. They are sometimes gone for long times, and cannot return all the way back to camp to be cured by the wise women. The settled people make the bottled magics that cure common disease and blight disease, but the Zainab are often in short supply of these things. Such bottled magics might be the trade goods we would want."
,,,,,,,,,,,,,,,,,,,,id_1910030832865517132,,,,,,,Topic,,,,Agent,,"I'm an agent. I work for a House, or a company, or the state, and I do things that need doing. All sorts of things. Mostly I handle matters in the business or diplomatic line, things that require mercantile skills, or the arts of speechcraft. I trade in knowledge -- hard facts and rumors. 'Knowledge is power', as they say. And sometimes I do other sorts of things. Things I can't talk about."
,,,,,,,,,,,,,,,,,,,,id_2390217901252541,,,,,,,Topic,,,,Agent,,"I'm an agent. I work for a House, or a company, or the state, and I do things that need doing. Mostly I handle matters in the business or diplomatic line, things that require mercantile skills, or the arts of speechcraft. I trade in knowledge -- hard facts and rumors. 'Knowledge is power', as they say. And sometimes I do other sorts of things. Things I can't talk about."
,,,,,,,,,,,,,,,,,,,,id_1446748261077814141,,,,,,,Topic,,,,Agent,,The Morag Tong only accepts legally approved contracts called 'writs'.
,,,,,,,,,,,,,,,,,,,,id_143815468932628305,,,,,,,Topic,,,,Alchemist,,"Anareren at the Ald'ruhn Guild of Mages is happy to talk your ear off about alchemy. He's been on Vvardenfell a while, and knows everything there is to know about practicing the profession here."
,,,,,,,,,,,,,,,,,,,,id_20868296541967631924,,,,,,,Topic,,,,Alchemist Service,,"Anareren at the Ald'ruhn Guild of Mages is happy to talk your ear off about alchemy. He's been on Vvardenfell a while, and knows everything there is to know about practicing the profession here."
,,,,,,,,,,,,,,,,,,,,id_3011525594147132329,,,,,,,Topic,,,,Alchemist Service,,"Fortify potions temporarily increase attributes and abilities. Fortify potions include: fortify strength, fortify intelligence, fortify willpower, fortify agility, fortify speed, fortify personality, fortify luck, fortify health, fortify magicka, fortify fatigue, and fortify endurance."
,,,,,,,,,,,,,,,,,,,,id_2567811702119319067,,,,,,,Topic,,,,Assassin,,"I'm an assassin. Killing is my profession. I am discrete, efficient, and reliable. In Morrowind, the assassin's trade is an ancient and honorable profession, restricted by a rigid code of conduct, and operating strictly within the law. Because I am discreet, I prefer short blades for swift, close-and-personal work, while the marksman weapons like throwing stars and throwing knives are more suitable for stealth and surprise."
,,,,,,,,,,,,,,,,,,,,id_27714143203180521012,,,,,,,Topic,,,,Assassin,,The Morag Tong only accepts legally approved contracts called 'writs'. Some Assassins are not quite so noble.
,,,,,,,,,,,,,,,,,,,,id_223772975612938954,,,,,,,Topic,,,,Assassin Service,,"I'm an assassin. Killing is my profession. I am discrete, efficient, and reliable. In Morrowind, the assassin's trade is an ancient and honorable profession, restricted by a rigid code of conduct, and operating strictly within the law. Because I am discreet, I prefer short blades for swift, close-and-personal work, while the marksman weapons like throwing stars and throwing knives are more suitable for stealth and surprise. I charge fair prices to train apprentices in the assassin's skills."
,,,,,,,,,,,,,,,,,,,,id_32043143222863424022,,,,,,,Topic,,,,Barbarian,,"I'm a barbarian, and proud of it. I like the wilderness, and know how to live comfortably off the land. I know the various native creatures of the wild, how to hunt them, what bits are good to eat, and what bits the city-folk will pay for. I know weapons and armor, and how to stay healthy, so I can play soldier for pay. But I hate taking orders, so I prefer to live by hunting."
,,,,,,,,,,,,,,,,,,,,id_10753691774624756,,,,,,,Topic,,,,Bard,,"The Blades is a prestigious service order for citizens demonstrating the greatest loyalty to the Emperor. To be named to the Blades by the Emperor is a great honor, and publicly acknowledged members serve openly in noble courts and diplomatic posts. Privately, many Blades members act as the Empire's intelligence agency. Such agents conceal themselves with secret identities, operating in disguise as couriers, observers, and spies throughout the Empire."
,,,,,,,,,,,,,,,,,,,,id_7532245362007625229,,,,,,,Greeting,,,,Guard,Temple,Where did you get that?! The armor you wear is sacred to our Order. You shall be punished with blood!
,,,,,,,,,,,,,,,,,,,,id_227322281661726892,,,,,,,Greeting,,,,Guard,,"What are you doing?! We'll let your actions go for now, but once you're released, stuff like that will get you arrested again."
,,,,,,,,,,,,,,,,,,,,id_2388613752739223814,,,,,,,Topic,,,,Healer,Imperial Cult,"Akatosh is the ultimate God of the Cyrodiilic Empire, where he embodies the qualities of endurance, invincibility, and everlasting legitimacy."
,,,,,,,,,,,,,,,,,,,,id_996115245710614507,,,,,,,Topic,,,,Healer,Imperial Cult,Cult members and respectful guests may make offerings and receive blessings at shrines; the faithful of higher ranks need make no offering to receive blessings.
,,,,,,,,,,,,,,,,,,,,id_21794194593228717824,,,,,,,Topic,,,,Healer,Imperial Cult,"In his aspect of Ysmir, 'Dragon of the North', Tiber Septim is also invoked as the patron of questing heroes."
,,,,,,,,,,,,,,,,,,,,id_233406283899512682,,,,,,,Topic,,,,Healer,Imperial Cult,"Tiber Septim was born on the continent of Atmora with the name 'Talos'. When he became Emperor of Tamriel, he took a Cyrodilic name -- Tiber Septim, the Dragon of the North."
,,,,,,,,,,,,,,,,,,,,id_23400124302873729725,,,,,,,Topic,,,,Healer,Temple,"Blessed Almalexia the Warden is one of the three Immortal God-Kings of Morrowind, a Pillar of the Tribunal, and the patron of Healers and Teachers."
,,,,,,,,,,,,,,,,,,,,id_83702455797368832,,,,,,,Topic,,,,Healer,Temple,"The Buoyant Armigers is a small military order of the Temple, exclusively dedicated to and answering to Lord Vivec."
,,,,,,,,,,,,,,,,,,,,id_3049712135151894272,,,,,,,Topic,,,,Healer,Temple,The four orders of Ordinators answer to the Alma Rula in Mournhold.
,,,,,,,,,,,,,,,,,,,,id_22916251742595225853,,,,,,,Topic,,,,Healer,Temple,"The Tribunal Temple is the native religion of civilized Morrowind. They worship three God-Kings, Almalexia, Sotha Sil, and Vivec, who are known together as the Tribunal. We usually just call it 'The Temple'."
,,,,,,,,,,,,,,,,,,,,id_898122883298037504,,,,,,,Topic,,,,Healer,,"I have not heard that there is a cure for skooma addiction. The Khajiit themselves say there is no cure, and they should know. But there is a book I have heard of, 'Confessions of a Dunmer Skooma-Eater', which claims to be a memoir of a Dunmer woman who overcame her addiction to skooma. This book praises skooma, and says that skooma addicts are not necessarily foolish or evil. Dunmer won't carry such a book. Try Vivec, Jobasha's Rare Books, in the Foreign Quarter."
,,,,,,,,,,,,,,,,,,,,id_1521828130478729327,,,,,,,Topic,,,,Healer Service,,"I have not heard that there is a cure for skooma addiction. The Khajiit themselves say there is no cure, and they should know. But there is a book I have heard of, 'Confessions of a Dunmer Skooma-Eater', which claims to be a memoir of a Dunmer woman who overcame her addiction to skooma. This book praises skooma, and says that skooma addicts are not necessarily foolish or evil. Dunmer won't carry such a book. Try Vivec, Jobasha's Rare Books, in the Foreign Quarter."
,,,,,,,,,,,,,,,,,,,,id_91232444431228699,,,,,,,Topic,,,,Knight,Imperial Legion,"High Rock encompasses the many lands and clans of Greater Bretony, the Dellese Isles, the Bjoulsae River tribes, and, by tradition, the Western Reach. The rugged highland strongholds and isolated valley settlements have encouraged the fierce independence of the various local Breton clans, and this contentious tribal nature has never been completely integrated into a provincial or Imperial identity. Nonetheless, their language, bardic traditions, and heroic legends are a unifying common legacy."
,,,,,,,,,,,,,,,,,,,,id_219685084866713461,,,,,,,Topic,,,,Knight,Imperial Legion,"Morrowind, homeland of the Dunmer peoples, is the northeastmost province of the Tamrielic Empire. Most of the population is gathered in the high uplands and fertile river valleys of central Morrowind, especially around the Inland Sea. The island Vvardenfell is encircled by the Inner Sea, and is dominated by the titanic volcano Red Mountain and its associated ash wastelands; most of the island's population is confined to the relatively hospitable west and southwest coast."
,,,,,,,,,,,,,,,,,,,,id_873163244797162,,,,,,,Topic,,,,Mage,,"I don't know whether vampirism is a disease. And if it is a disease, I don't know if it can be cured, or how. But I have heard rumors of a cure for vampirism. And I recall reading a reference in a rare local book that might be useful. Look for a book called 'Vampires of Vvardenfell, Volume II'. It might be hard to find here. It was suppressed by the Temple. But I recall reading something there about a Buoyant Armiger who became a vampire, but who was cured."
,,,,,,,,,,,,,,,,,,,,id_313146838840421288,,,,,,,Topic,,,,Mage,,"If you want to know everything there is to know about being a mage, let me suggest Estirdalin at the Balmora Mages Guild. You want to talk to an expert in the trade, patient, and well-spoken -- someone who likes to talk about the subjects. You don't want a trainer -- not unless you expect to pay for the information. And you don't want someone too busy or important to talk to you. Try Estirdalin. She's smart, friendly, and ready to talk."
,,,,,,,,,,,,,,,,,,,,id_2169812524305609729,,,,,,,Topic,,,,Mage Service,,"I don't know whether vampirism is a disease. And if it is a disease, I don't know if it can be cured, or how. But I have heard rumors of a cure for vampirism. And I recall reading a reference in a rare local book that might be useful. Look for a book called 'Vampires of Vvardenfell, Volume II'. It might be hard to find here. It was suppressed by the Temple. But I recall reading something there about a Buoyant Armiger who became a vampire, but who was cured."
,,,,,,,,,,,,,,,,,,,,id_542625647341320968,,,,,,,Topic,,,,Mage Service,,"If you want to know everything there is to know about being a mage, let me suggest Estirdalin at the Balmora Mages Guild. You want to talk to an expert in the trade, patient, and well-spoken -- someone who likes to talk about the subjects. You don't want a trainer -- not unless you expect to pay for the information. And you don't want someone too busy or important to talk to you. Try Estirdalin. She's smart, friendly, and ready to talk."
,,,,,,,,,,,,,,,,,,,,id_131343992602821645,,,,,,,Topic,,,,Master-at-Arms,,"The master-at-arms at Fort Pelagiad, Angoril, is a good source if you are curious about the master-at-arms' trade in Morrowind. He's a little long-winded, but he knows his stuff, and he's always willing."
,,,,,,,,,,,,,,,,,,,,id_509116663106572775,,,,,,,Topic,,,,Merchant,,The blight storms have been so bad around Red Mountain this year that the crops and herds of the outlying villages are really suffering. The price of everything has got to go up.
,,,,,,,,,,,,,,,,,,,,id_2046811183206471931,,,,,,,Topic,,,,Miner,,"A diseased kwama mine is a great hardship for the whole mining community. Blighted eggs are inedible, and miners catch blight diseases."
,,,,,,,,,,,,,,,,,,,,id_2406622006460811801,,,,,,,Topic,,,,Miner,,"I am a miner. Usually here on Vvardenfell, being a miner means you're an egg miner. Scrib jerky and scrib jelly, kwama eggs and kwama cuttle are the basis of our Vvardenfell economy. Yes, there are more valuable resources we take from mines -- raw ebony, raw glass, dreugh wax, daedra skin, daedra heart, diamond, ash salts, and so forth -- and that's good work, too. But it's the egg miners that feed Morrowind, and bring cash from all over the Empire."
,,,,,,,,,,,,,,,,,,,,id_20160125141604927941,,,,,,,Topic,,,,Monk,Imperial Cult,"Akatosh is the ultimate God of the Cyrodiilic Empire, where he embodies the qualities of endurance, invincibility, and everlasting legitimacy."
,,,,,,,,,,,,,,,,,,,,id_29489307592027640,,,,,,,Topic,,,,Monk,Imperial Cult,Cult members and respectful guests may make offerings and receive blessings at shrines; the faithful of higher ranks need make no offering to receive blessings.
,,,,,,,,,,,,,,,,,,,,id_791106401125231654,,,,,,,Topic,,,,Monk,Imperial Cult,"In his aspect of Ysmir, 'Dragon of the North', Tiber Septim is also invoked as the patron of questing heroes."
,,,,,,,,,,,,,,,,,,,,id_1609278022941839,,,,,,,Topic,,,,Monk,Imperial Cult,"Tiber Septim was born on the continent of Atmora with the name 'Talos'. When he became Emperor of Tamriel, he took a Cyrodilic name -- Tiber Septim, the Dragon of the North."
,,,,,,,,,,,,,,,,,,,,id_291698767214291631,,,,,,,Topic,,,,Monk,Temple,"Blessed Almalexia the Warden is one of the three Immortal God-Kings of Morrowind, a Pillar of the Tribunal, and the patron of Healers and Teachers."
,,,,,,,,,,,,,,,,,,,,id_13346648153962120,,,,,,,Topic,,,,Monk,Temple,"The Buoyant Armigers is a small military order of the Temple, exclusively dedicated to and answering to Lord Vivec."
,,,,,,,,,,,,,,,,,,,,id_584664143255829773,,,,,,,Topic,,,,Monk,Temple,The four orders of Ordinators answer to the Alma Rula in Mournhold.
,,,,,,,,,,,,,,,,,,,,id_26308178341162425,,,,,,,Topic,,,,Monk,Temple,"The Tribunal Temple is the native religion of civilized Morrowind. They worship three God-Kings, Almalexia, Sotha Sil, and Vivec, who are known together as the Tribunal. We usually just call it 'The Temple'."
,,,,,,,,,,,,,,,,,,,,id_1099415527244467957,,,,,,,Topic,,,,Noble,,"Dark Elves are the dark-skinned, red-eyed Elven peoples of Morrowind. The 'dark' part may come from their dark grey skin, but it also fits their gloomy dispositions. Folks call them 'Dark Elf' in the West, but they call themselves the 'Dunmer'. They have no sense of humor, and always take themselves very seriously. They look down their noses at all the other races -- particularly the Khajiit and Argonians, which they treat like animals."
,,,,,,,,,,,,,,,,,,,,id_26653148642147220888,,,,,,,Topic,,,,Noble,,"Morrowind is a peculiar mixture of Dunmer tradition and Imperial modernism. The council system of government works well, and the Temple provides shelter, education, and health for all. At the same time, the Legions and magistrates guarantee rule of law and justice, and free trade has made everybody in Vvardenfell prosperous. But there's still a lot of race hatred, and slavery ought to be outlawed, regardless of 'sacred Dunmer customs'. And the proud Dunmer will always be bitter about the Occupation."
,,,,,,,,,,,,,,,,,,,,id_465170372761719236,,,,,,,Topic,,,,Noble,,"The city of Mournhold is located in Indoril District, on the mainland, and the Indoril are orthodox and conservative supporters of the Temple and Temple authority."
,,,,,,,,,,,,,,,,,,,,id_15944258109985949,,,,,,,Topic,,,,Noble,,"The Morag Tong only accepts legally approved contracts called 'writs', but rumor hints at the execution of secret extralegal 'grey writs'."
,,,,,,,,,,,,,,,,,,,,id_192781404496213424,,,,,,,Topic,,,,Priest,Imperial Cult,"Akatosh is the ultimate God of the Cyrodiilic Empire, where he embodies the qualities of endurance, invincibility, and everlasting legitimacy."
,,,,,,,,,,,,,,,,,,,,id_4568106683157828169,,,,,,,Topic,,,,Priest,Imperial Cult,Cult members and respectful guests may make offerings and receive blessings at shrines; the faithful of higher ranks need make no offering to receive blessings.
,,,,,,,,,,,,,,,,,,,,id_84085385165514765,,,,,,,Topic,,,,Priest,Imperial Cult,"High Rock encompasses the many lands and clans of Greater Bretony, the Dellese Isles, the Bjoulsae River tribes, and, by tradition, the Western Reach. The rugged highland strongholds and isolated valley settlements have encouraged the fierce independence of the various local Breton clans, and this contentious tribal nature has never been completely integrated into a provincial or Imperial identity. Nonetheless, their language, bardic traditions, and heroic legends are a unifying common legacy."
,,,,,,,,,,,,,,,,,,,,id_2444119394236235779,,,,,,,Topic,,,,Priest,Imperial Cult,"In his aspect of Ysmir, 'Dragon of the North', Tiber Septim is also invoked as the patron of questing heroes."
,,,,,,,,,,,,,,,,,,,,id_10810221091046128251,,,,,,,Topic,,,,Priest,Imperial Cult,"Morrowind, homeland of the Dunmer peoples, is the northeastmost province of the Tamrielic Empire. Most of the population is gathered in the high uplands and fertile river valleys of central Morrowind, especially around the Inland Sea. The island Vvardenfell is encircled by the Inner Sea, and is dominated by the titanic volcano Red Mountain and its associated ash wastelands; most of the island's population is confined to the relatively hospitable west and southwest coast."
,,,,,,,,,,,,,,,,,,,,id_234572650753411095,,,,,,,Topic,,,,Priest,Imperial Cult,"Tiber Septim was born on the continent of Atmora with the name 'Talos'. When he became Emperor of Tamriel, he took a Cyrodilic name -- Tiber Septim, the Dragon of the North."
,,,,,,,,,,,,,,,,,,,,id_30950265203270317142,,,,,,,Topic,,,,Priest,Temple,"Blessed Almalexia the Warden is one of the three Immortal God-Kings of Morrowind, a Pillar of the Tribunal, and the patron of Healers and Teachers."
,,,,,,,,,,,,,,,,,,,,id_20943207603001718478,,,,,,,Topic,,,,Priest,Temple,"The Buoyant Armigers is a small military order of the Temple, exclusively dedicated to and answering to Lord Vivec."
,,,,,,,,,,,,,,,,,,,,id_11817181141395430906,,,,,,,Topic,,,,Priest,Temple,The four orders of Ordinators answer to the Alma Rula in Mournhold.
,,,,,,,,,,,,,,,,,,,,id_2980930061296411993,,,,,,,Topic,,,,Priest,Temple,"The Tribunal Temple is the native religion of civilized Morrowind. They worship three God-Kings, Almalexia, Sotha Sil, and Vivec, who are known together as the Tribunal. We usually just call it 'The Temple'."
